{
  "$schema": "./schemas/graphics-profiles.schema.json",
  "schemaVersion": 1,
  "generatedAtUtc": "2026-07-15T18:49:36Z",
  "baseClient": {
    "componentId": "tethealla-59nl-english",
    "executablePath": "Psobb.exe",
    "executableSha256": "dd3d475916038e8e8e3f230cfad6d8d93a2976b1b42af0014413ff3b737c5535"
  },
  "acceptanceTarget": {
    "physicalDisplay": {
      "manufacturerId": "AUO",
      "productCode": "7DB2",
      "width": 2560,
      "height": 1600,
      "refreshHz": 240
    },
    "trueWidescreenRenderCeiling": {
      "width": 3840,
      "height": 2400
    },
    "defaultWindowMode": "borderless",
    "colorSpace": "sdr-source-faithful"
  },
  "invariants": {
    "d3d8OwnerCount": 1,
    "allowDgVoodooD3D12": false,
    "allowGlobalDriverOverrides": false,
    "allowCredentials": false,
    "blockedDefaultEffects": [
      "ambient-occlusion",
      "bloom",
      "chromatic-aberration",
      "color-grading",
      "depth-of-field",
      "film-grain",
      "hdr-conversion",
      "smaa",
      "tone-mapping"
    ]
  },
  "profiles": [
    {
      "id": "safe-native-4x3",
      "channel": "stable",
      "distributionClass": "public-gated",
      "purpose": "Immutable emergency fallback with no graphics proxy.",
      "nativeGraphics": {
        "presetId": "mid-compatibility",
        "graphicCtrlDwords": [
          1,
          0,
          0,
          0,
          1,
          1,
          1,
          0,
          0
        ],
        "graphicCtrlSha256": "a27bceac8141950aa389c1d96c70ebdb3db8a3c8dc88ef070cafffc245fc1917",
        "advancedEffectsPolicy": "compatibility",
        "pixelFogPolicy": "pixel",
        "lowResolutionTexturesPolicy": "disabled",
        "frameSkipPolicy": "disabled"
      },
      "renderer": {
        "d3d8Owner": {
          "kind": "application",
          "componentId": null,
          "relativePath": null,
          "role": "d3d8-owner"
        },
        "secondaryLayers": [],
        "outputApi": "d3d8-native",
        "featureLevel": null
      },
      "display": {
        "output": {
          "width": 1024,
          "height": 768,
          "fit": "application-controlled"
        },
        "aspectPolicy": "preserve-4x3",
        "internalRenderCandidates": [
          {
            "width": 1024,
            "height": 768
          }
        ],
        "selectedInternalRender": {
          "width": 1024,
          "height": 768
        },
        "renderCeiling": {
          "width": 1024,
          "height": 768
        },
        "windowModes": [
          "application-controlled"
        ],
        "defaultWindowMode": "application-controlled",
        "selectedWindowMode": null,
        "monitorPolicy": "application-controlled",
        "scalingFilterCandidates": [
          "application-controlled"
        ],
        "selectedScalingFilter": "application-controlled"
      },
      "quality": {
        "anisotropicFiltering": "application-controlled",
        "mipmapping": "application-controlled",
        "preservePointSampled": true,
        "bilinear2DOperations": true,
        "msaaCandidates": [
          0
        ],
        "selectedMsaa": 0,
        "virtualVramMbCandidates": [
          "application-controlled"
        ],
        "selectedVirtualVramMb": "application-controlled",
        "vsyncOwnerCandidates": [
          "application-controlled"
        ],
        "selectedVsyncOwner": "application-controlled",
        "vsyncOwner": "application",
        "frameLimitOwner": "application",
        "watermarkEnabled": false,
        "colorSpace": "sdr-source-faithful"
      },
      "postProcessing": {
        "enabledByDefault": false,
        "effectComponentId": null,
        "strengthCandidates": [],
        "selectedStrength": null
      },
      "clientPatchRequirements": [],
      "rollbackProfileId": null
    },
    {
      "id": "clarity-dgvoodoo-4x3",
      "channel": "canary",
      "distributionClass": "public-gated",
      "purpose": "Known-good D3D11 FL11 supersampled 4:3 clarity baseline.",
      "nativeGraphics": {
        "presetId": "high-end",
        "graphicCtrlDwords": [
          0,
          0,
          0,
          0,
          1,
          1,
          1,
          0,
          0
        ],
        "graphicCtrlSha256": "302f04ac1917b0eaecef147a99f7cada007b8bb8cc9ac1d9fd16b1a47d72e8a4",
        "advancedEffectsPolicy": "enabled",
        "pixelFogPolicy": "pixel",
        "lowResolutionTexturesPolicy": "disabled",
        "frameSkipPolicy": "disabled"
      },
      "renderer": {
        "d3d8Owner": {
          "kind": "proxy",
          "componentId": "dgvoodoo2-x86-d3d8",
          "relativePath": "d3d8.dll",
          "role": "d3d8-owner"
        },
        "secondaryLayers": [],
        "outputApi": "d3d11_fl11_0",
        "featureLevel": "11_0"
      },
      "display": {
        "output": {
          "width": 2560,
          "height": 1600,
          "fit": "aspect-preserving-pillarbox"
        },
        "aspectPolicy": "preserve-4x3",
        "internalRenderCandidates": [
          {
            "width": 2560,
            "height": 1920
          },
          {
            "width": 3840,
            "height": 2880
          }
        ],
        "selectedInternalRender": {
          "width": 3840,
          "height": 2880
        },
        "renderCeiling": {
          "width": 3840,
          "height": 2880
        },
        "windowModes": [
          "borderless",
          "resizable"
        ],
        "defaultWindowMode": "borderless",
        "selectedWindowMode": null,
        "monitorPolicy": "physical-auo-2560x1600-first",
        "scalingFilterCandidates": [
          "lanczos-3",
          "lanczos-2",
          "bicubic"
        ],
        "selectedScalingFilter": "lanczos-3"
      },
      "quality": {
        "anisotropicFiltering": 16,
        "mipmapping": "application-driven",
        "preservePointSampled": true,
        "bilinear2DOperations": false,
        "msaaCandidates": [
          0
        ],
        "selectedMsaa": 0,
        "virtualVramMbCandidates": [
          256,
          1024,
          2048,
          4096
        ],
        "selectedVirtualVramMb": null,
        "vsyncOwnerCandidates": [
          "none",
          "dgvoodoo"
        ],
        "selectedVsyncOwner": null,
        "vsyncOwner": "none",
        "frameLimitOwner": "none",
        "watermarkEnabled": false,
        "colorSpace": "sdr-source-faithful"
      },
      "postProcessing": {
        "enabledByDefault": false,
        "effectComponentId": null,
        "strengthCandidates": [],
        "selectedStrength": null
      },
      "clientPatchRequirements": [],
      "rollbackProfileId": "safe-native-4x3"
    },
    {
      "id": "lab-widescreen-16x10",
      "channel": "local-lab",
      "distributionClass": "local-only",
      "purpose": "Black-box, nonredistributable 16:10 behavior and feasibility evaluation.",
      "nativeGraphics": {
        "presetId": "high-end",
        "graphicCtrlDwords": [
          0,
          0,
          0,
          0,
          1,
          1,
          1,
          0,
          0
        ],
        "graphicCtrlSha256": "302f04ac1917b0eaecef147a99f7cada007b8bb8cc9ac1d9fd16b1a47d72e8a4",
        "advancedEffectsPolicy": "enabled",
        "pixelFogPolicy": "pixel",
        "lowResolutionTexturesPolicy": "disabled",
        "frameSkipPolicy": "disabled"
      },
      "renderer": {
        "d3d8Owner": {
          "kind": "proxy",
          "componentId": "dgvoodoo2-x86-d3d8",
          "relativePath": "d3d8.dll",
          "role": "d3d8-owner"
        },
        "secondaryLayers": [
          {
            "componentId": "ultimate-asi-loader-x86",
            "relativePath": "dinput8.dll",
            "role": "asi-loader",
            "declaredOrder": 20
          },
          {
            "componentId": "psobb-widescreen-local-evaluation",
            "relativePath": "plugins/pso_widescreen.asi",
            "role": "widescreen-reference",
            "declaredOrder": 30
          }
        ],
        "outputApi": "d3d11_fl11_0",
        "featureLevel": "11_0"
      },
      "display": {
        "output": {
          "width": 2560,
          "height": 1600,
          "fit": "exact-full-panel"
        },
        "aspectPolicy": "expand-horizontal-16x10",
        "internalRenderCandidates": [
          {
            "width": 2560,
            "height": 1600
          },
          {
            "width": 3840,
            "height": 2400
          }
        ],
        "selectedInternalRender": null,
        "renderCeiling": {
          "width": 3840,
          "height": 2400
        },
        "windowModes": [
          "borderless",
          "resizable"
        ],
        "defaultWindowMode": "borderless",
        "selectedWindowMode": null,
        "presentationOwner": "client-patch",
        "monitorPolicy": "physical-auo-2560x1600-first",
        "scalingFilterCandidates": [
          "lanczos-3",
          "lanczos-2",
          "bicubic"
        ],
        "selectedScalingFilter": null
      },
      "quality": {
        "anisotropicFiltering": 16,
        "mipmapping": "application-driven",
        "preservePointSampled": true,
        "bilinear2DOperations": false,
        "msaaCandidates": [
          0,
          4,
          8
        ],
        "selectedMsaa": null,
        "virtualVramMbCandidates": [
          256,
          1024,
          2048,
          4096
        ],
        "selectedVirtualVramMb": null,
        "vsyncOwnerCandidates": [
          "none",
          "dgvoodoo"
        ],
        "selectedVsyncOwner": null,
        "vsyncOwner": "none",
        "frameLimitOwner": "none",
        "watermarkEnabled": false,
        "colorSpace": "sdr-source-faithful"
      },
      "postProcessing": {
        "enabledByDefault": false,
        "effectComponentId": null,
        "strengthCandidates": [],
        "selectedStrength": null
      },